{
  "actual_result": "registry rejected as expected: TypeError('payload must be a mapping')",
  "agent_lane": "edge_case",
  "artifact_paths": [
    "sandbox/runs/SR-a63546096e/stdout.log",
    "sandbox/runs/SR-a63546096e/stderr.log"
  ],
  "classification": "no_failure_observed",
  "created_at": "2026-05-05T01:50:07.262993Z",
  "exit_code": 0,
  "expected_result": "Validation error, registry remains stable.",
  "failure_case_id": "FC-0006",
  "promotion_status": "pending_operator_review",
  "receipt_hash": "4e2b8319c45572b4028f658282fc03acba449dc307746a9079d4cd1c8b06b72c",
  "receipt_id": "FHR-4e9ef64d27",
  "repro_command": "./scripts/replay_failure.sh sandbox/receipts/FHR-4e9ef64d27.json",
  "reproducible": true,
  "sandbox_run_id": "SR-a63546096e",
  "schema_version": "FailureHarvestReceipt.v1",
  "severity": "info",
  "stderr_excerpt": "",
  "stdout_excerpt": "",
  "target_ref": "demo",
  "target_repo": "example-repo"
}