{
  "actual_result": "registry rejected as expected: TypeError('payload must be a mapping')",
  "agent_lane": "edge_case",
  "artifact_paths": [
    "sandbox/runs/SR-1fc0430825/stdout.log",
    "sandbox/runs/SR-1fc0430825/stderr.log"
  ],
  "classification": "no_failure_observed",
  "created_at": "2026-05-07T04:40:56.505366Z",
  "exit_code": 0,
  "expected_result": "Validation error, registry remains stable.",
  "failure_case_id": "FC-0006",
  "promotion_status": "pending_operator_review",
  "receipt_hash": "61bdcd97293ea6f7e76b1a15279eb9847750fc85ca8b730e6696620570421fce",
  "receipt_id": "FHR-33955cc3fd",
  "repro_command": "./scripts/replay_failure.sh sandbox/receipts/FHR-33955cc3fd.json",
  "reproducible": true,
  "sandbox_run_id": "SR-1fc0430825",
  "schema_version": "FailureHarvestReceipt.v1",
  "severity": "info",
  "stderr_excerpt": "",
  "stdout_excerpt": "",
  "target_ref": "ci-gate",
  "target_repo": "example-repo"
}