{
  "actual_result": "registry rejected as expected: ValueError('unknown kind: not_an_allowed_kind')",
  "agent_lane": "edge_case",
  "artifact_paths": [
    "sandbox/runs/SR-03b9c9ad73/stdout.log",
    "sandbox/runs/SR-03b9c9ad73/stderr.log"
  ],
  "classification": "no_failure_observed",
  "created_at": "2026-05-20T17:33:10.627932Z",
  "exit_code": 0,
  "expected_result": "ValueError or rejection.",
  "failure_case_id": "FC-0003",
  "promotion_status": "pending_operator_review",
  "receipt_hash": "76d055062064e349d8bf574432df3df764a38094109b420fd1d4b83453c31910",
  "receipt_id": "FHR-72a4e1f255",
  "repro_command": "./scripts/replay_failure.sh sandbox/receipts/FHR-72a4e1f255.json",
  "reproducible": true,
  "sandbox_run_id": "SR-03b9c9ad73",
  "schema_version": "FailureHarvestReceipt.v1",
  "severity": "info",
  "stderr_excerpt": "",
  "stdout_excerpt": "",
  "target_ref": "ci-gate",
  "target_repo": "example-repo"
}