{
  "actual_result": "registry rejected as expected: TypeError('payload must be a mapping')",
  "agent_lane": "edge_case",
  "artifact_paths": [
    "sandbox/runs/SR-364c6dc753/stdout.log",
    "sandbox/runs/SR-364c6dc753/stderr.log"
  ],
  "classification": "no_failure_observed",
  "created_at": "2026-05-21T20:58:25.991112Z",
  "exit_code": 0,
  "expected_result": "Validation error, registry remains stable.",
  "failure_case_id": "FC-0006",
  "promotion_status": "pending_operator_review",
  "receipt_hash": "513e9531bda3173dae49fd7bca36d41733ccf49f2ce5551e0c563ba5f57bc504",
  "receipt_id": "FHR-5fd4475055",
  "repro_command": "./scripts/replay_failure.sh sandbox/receipts/FHR-5fd4475055.json",
  "reproducible": true,
  "sandbox_run_id": "SR-364c6dc753",
  "schema_version": "FailureHarvestReceipt.v1",
  "severity": "info",
  "stderr_excerpt": "",
  "stdout_excerpt": "",
  "target_ref": "ci-gate",
  "target_repo": "example-repo"
}