{
  "actual_result": "registry rejected as expected: ValueError('unknown kind: not_an_allowed_kind')",
  "agent_lane": "edge_case",
  "artifact_paths": [
    "sandbox/runs/SR-external-source/stdout.log",
    "sandbox/runs/SR-external-source/stderr.log"
  ],
  "classification": "no_failure_observed",
  "created_at": "2026-05-21T20:58:25.102956Z",
  "exit_code": 0,
  "expected_result": "ValueError or rejection.",
  "failure_case_id": "FC-0003",
  "promotion_status": "pending_operator_review",
  "receipt_hash": "47c8681109abc58e976b71901390a11395287e96248b6149d9b8d27a64f64f45",
  "receipt_id": "FHR-03aec0bdb7",
  "repro_command": "./scripts/replay_failure.sh sandbox/receipts/FHR-03aec0bdb7.json --target-source /tmp/pytest-of-charlie/pytest-11/test_cli_runs_external_target_0/example-repo --adapter fixtures/valid/TargetAdapter.v1.valid.json",
  "reproducible": true,
  "sandbox_run_id": "SR-external-source",
  "schema_version": "FailureHarvestReceipt.v1",
  "severity": "info",
  "stderr_excerpt": "",
  "stdout_excerpt": "",
  "target_ref": "local",
  "target_repo": "example-repo"
}