{
  "actual_result": "duplicate input created a new record: first_id='r0001' second_id='r0002' size=2",
  "agent_lane": "edge_case",
  "artifact_paths": [
    "sandbox/runs/SR-364c6dc753/stdout.log",
    "sandbox/runs/SR-364c6dc753/stderr.log"
  ],
  "classification": "duplicate_replay",
  "created_at": "2026-05-21T20:58:25.987383Z",
  "exit_code": 0,
  "expected_result": "Existing result reused or duplicate rejected.",
  "failure_case_id": "FC-0001",
  "promotion_status": "pending_operator_review",
  "receipt_hash": "8c2e3837dc95aa49290d93386882b0d59a88735c70c14fa875c3b8bbe0678fcb",
  "receipt_id": "FHR-f87c499749",
  "repro_command": "./scripts/replay_failure.sh sandbox/receipts/FHR-f87c499749.json",
  "reproducible": true,
  "sandbox_run_id": "SR-364c6dc753",
  "schema_version": "FailureHarvestReceipt.v1",
  "severity": "high",
  "stderr_excerpt": "",
  "stdout_excerpt": "",
  "target_ref": "ci-gate",
  "target_repo": "example-repo"
}