{
  "actual_result": "registry rejected as expected: ValueError('unsafe path: ../../etc/passwd')",
  "agent_lane": "edge_case",
  "artifact_paths": [
    "sandbox/runs/SR-37d9b23160/stdout.log",
    "sandbox/runs/SR-37d9b23160/stderr.log"
  ],
  "classification": "no_failure_observed",
  "created_at": "2026-05-20T17:25:54.151120Z",
  "exit_code": 0,
  "expected_result": "Path rejected with safety error.",
  "failure_case_id": "FC-0004",
  "promotion_status": "pending_operator_review",
  "receipt_hash": "77cfb9e23182de34fec6ca864268ac6885206b68ffc7ea63d5f8be97d612c73f",
  "receipt_id": "FHR-b04312ab26",
  "repro_command": "./scripts/replay_failure.sh sandbox/receipts/FHR-b04312ab26.json",
  "reproducible": true,
  "sandbox_run_id": "SR-37d9b23160",
  "schema_version": "FailureHarvestReceipt.v1",
  "severity": "info",
  "stderr_excerpt": "",
  "stdout_excerpt": "",
  "target_ref": "ci-gate",
  "target_repo": "example-repo"
}