{
  "actual_result": "duplicate input created a new record: first_id='r0001' second_id='r0002' size=2",
  "agent_lane": "edge_case",
  "artifact_paths": [
    "sandbox/runs/SR-37d9b23160/stdout.log",
    "sandbox/runs/SR-37d9b23160/stderr.log"
  ],
  "classification": "duplicate_replay",
  "created_at": "2026-05-20T17:25:54.148854Z",
  "exit_code": 0,
  "expected_result": "Existing result reused or duplicate rejected.",
  "failure_case_id": "FC-0001",
  "promotion_status": "pending_operator_review",
  "receipt_hash": "69191b4513b05fb8824e9789e537738c4945103d296f99eb86d35846346d3eca",
  "receipt_id": "FHR-1fb8823fd4",
  "repro_command": "./scripts/replay_failure.sh sandbox/receipts/FHR-1fb8823fd4.json",
  "reproducible": true,
  "sandbox_run_id": "SR-37d9b23160",
  "schema_version": "FailureHarvestReceipt.v1",
  "severity": "high",
  "stderr_excerpt": "",
  "stdout_excerpt": "",
  "target_ref": "ci-gate",
  "target_repo": "example-repo"
}