{
  "actual_result": "registry rejected as expected: ValueError('unsafe path: ../../etc/passwd')",
  "agent_lane": "edge_case",
  "artifact_paths": [
    "sandbox/runs/SR-no-canonical-mutation/stdout.log",
    "sandbox/runs/SR-no-canonical-mutation/stderr.log"
  ],
  "classification": "no_failure_observed",
  "created_at": "2026-05-21T20:58:26.721896Z",
  "exit_code": 0,
  "expected_result": "Path rejected with safety error.",
  "failure_case_id": "FC-0004",
  "promotion_status": "pending_operator_review",
  "receipt_hash": "6645b813f04813f5b2838b2f04d6f596d7b800bacf0d4e0fa02621e21612bba3",
  "receipt_id": "FHR-abf7cb6fe4",
  "repro_command": "./scripts/replay_failure.sh sandbox/receipts/FHR-abf7cb6fe4.json",
  "reproducible": true,
  "sandbox_run_id": "SR-no-canonical-mutation",
  "schema_version": "FailureHarvestReceipt.v1",
  "severity": "info",
  "stderr_excerpt": "",
  "stdout_excerpt": "",
  "target_ref": "no-canonical-mutation",
  "target_repo": "example-repo"
}