{
  "actual_result": "registry rejected as expected: KeyError('missing required field: value')",
  "agent_lane": "edge_case",
  "artifact_paths": [
    "sandbox/runs/SR-37d9b23160/stdout.log",
    "sandbox/runs/SR-37d9b23160/stderr.log"
  ],
  "classification": "no_failure_observed",
  "created_at": "2026-05-20T17:25:54.149676Z",
  "exit_code": 0,
  "expected_result": "ValueError or rejection.",
  "failure_case_id": "FC-0002",
  "promotion_status": "pending_operator_review",
  "receipt_hash": "d3aa843061d71896448bd9dacd62a1924e7d4310cc2d3c09799cbe78bd94d8ad",
  "receipt_id": "FHR-ed499d315f",
  "repro_command": "./scripts/replay_failure.sh sandbox/receipts/FHR-ed499d315f.json",
  "reproducible": true,
  "sandbox_run_id": "SR-37d9b23160",
  "schema_version": "FailureHarvestReceipt.v1",
  "severity": "info",
  "stderr_excerpt": "",
  "stdout_excerpt": "",
  "target_ref": "ci-gate",
  "target_repo": "example-repo"
}