{
  "actual_result": "registry rejected as expected: KeyError('missing required field: value')",
  "agent_lane": "edge_case",
  "artifact_paths": [
    "sandbox/runs/SR-no-canonical-mutation/stdout.log",
    "sandbox/runs/SR-no-canonical-mutation/stderr.log"
  ],
  "classification": "no_failure_observed",
  "created_at": "2026-05-21T20:58:26.720145Z",
  "exit_code": 0,
  "expected_result": "ValueError or rejection.",
  "failure_case_id": "FC-0002",
  "promotion_status": "pending_operator_review",
  "receipt_hash": "f529345a12da73de021e44c9774559c58c78f7bbabb2236fcc88e3affd3107a9",
  "receipt_id": "FHR-78ed924d57",
  "repro_command": "./scripts/replay_failure.sh sandbox/receipts/FHR-78ed924d57.json",
  "reproducible": true,
  "sandbox_run_id": "SR-no-canonical-mutation",
  "schema_version": "FailureHarvestReceipt.v1",
  "severity": "info",
  "stderr_excerpt": "",
  "stdout_excerpt": "",
  "target_ref": "no-canonical-mutation",
  "target_repo": "example-repo"
}