{
  "actual_result": "registry rejected as expected: ValueError('unsafe path: ../../etc/passwd')",
  "agent_lane": "edge_case",
  "artifact_paths": [
    "sandbox/runs/SR-external-source/stdout.log",
    "sandbox/runs/SR-external-source/stderr.log"
  ],
  "classification": "no_failure_observed",
  "created_at": "2026-05-21T20:58:25.103780Z",
  "exit_code": 0,
  "expected_result": "Path rejected with safety error.",
  "failure_case_id": "FC-0004",
  "promotion_status": "pending_operator_review",
  "receipt_hash": "c46d8b609ab31c1377f40248cf94f8644e2fcfaa79c7710a89ecd6ec34584f86",
  "receipt_id": "FHR-a1f2506237",
  "repro_command": "./scripts/replay_failure.sh sandbox/receipts/FHR-a1f2506237.json --target-source /tmp/pytest-of-charlie/pytest-11/test_cli_runs_external_target_0/example-repo --adapter fixtures/valid/TargetAdapter.v1.valid.json",
  "reproducible": true,
  "sandbox_run_id": "SR-external-source",
  "schema_version": "FailureHarvestReceipt.v1",
  "severity": "info",
  "stderr_excerpt": "",
  "stdout_excerpt": "",
  "target_ref": "local",
  "target_repo": "example-repo"
}