{
  "actual_result": "registry rejected as expected: ValueError('unsafe path: ../../etc/passwd')",
  "agent_lane": "edge_case",
  "artifact_paths": [
    "sandbox/runs/SR-a63546096e/stdout.log",
    "sandbox/runs/SR-a63546096e/stderr.log"
  ],
  "classification": "no_failure_observed",
  "created_at": "2026-05-05T01:50:07.261789Z",
  "exit_code": 0,
  "expected_result": "Path rejected with safety error.",
  "failure_case_id": "FC-0004",
  "promotion_status": "pending_operator_review",
  "receipt_hash": "d7d33c88b6af1c7eb96c5d6873fc2718966dd4d6cae1dc4fa5e00512d1515ffe",
  "receipt_id": "FHR-d587efb83e",
  "repro_command": "./scripts/replay_failure.sh sandbox/receipts/FHR-d587efb83e.json",
  "reproducible": true,
  "sandbox_run_id": "SR-a63546096e",
  "schema_version": "FailureHarvestReceipt.v1",
  "severity": "info",
  "stderr_excerpt": "",
  "stdout_excerpt": "",
  "target_ref": "demo",
  "target_repo": "example-repo"
}