{
  "actual_result": "registry rejected as expected: ValueError('unknown kind: not_an_allowed_kind')",
  "agent_lane": "edge_case",
  "artifact_paths": [
    "sandbox/runs/SR-37d9b23160/stdout.log",
    "sandbox/runs/SR-37d9b23160/stderr.log"
  ],
  "classification": "no_failure_observed",
  "created_at": "2026-05-20T17:25:54.150396Z",
  "exit_code": 0,
  "expected_result": "ValueError or rejection.",
  "failure_case_id": "FC-0003",
  "promotion_status": "pending_operator_review",
  "receipt_hash": "82615f2e524b3ccefa5e9d3fbde62b4d5fa8b6cab49198d85bbefef86e6b4e83",
  "receipt_id": "FHR-4f590a1795",
  "repro_command": "./scripts/replay_failure.sh sandbox/receipts/FHR-4f590a1795.json",
  "reproducible": true,
  "sandbox_run_id": "SR-37d9b23160",
  "schema_version": "FailureHarvestReceipt.v1",
  "severity": "info",
  "stderr_excerpt": "",
  "stdout_excerpt": "",
  "target_ref": "ci-gate",
  "target_repo": "example-repo"
}