{
  "actual_result": "NUL byte was sanitized or rejected",
  "agent_lane": "edge_case",
  "artifact_paths": [
    "sandbox/runs/SR-a63546096e/stdout.log",
    "sandbox/runs/SR-a63546096e/stderr.log"
  ],
  "classification": "no_failure_observed",
  "created_at": "2026-05-05T01:50:07.262429Z",
  "exit_code": 0,
  "expected_result": "Sanitized or rejected.",
  "failure_case_id": "FC-0005",
  "promotion_status": "pending_operator_review",
  "receipt_hash": "548bf1fa8d0cd098636a4134fbf884a4529c71a5111c270ffb4de36e9c320f7c",
  "receipt_id": "FHR-85e8368902",
  "repro_command": "./scripts/replay_failure.sh sandbox/receipts/FHR-85e8368902.json",
  "reproducible": true,
  "sandbox_run_id": "SR-a63546096e",
  "schema_version": "FailureHarvestReceipt.v1",
  "severity": "info",
  "stderr_excerpt": "",
  "stdout_excerpt": "",
  "target_ref": "demo",
  "target_repo": "example-repo"
}