{
  "actual_result": "duplicate input created a new record: first_id='r0001' second_id='r0002' size=2",
  "agent_lane": "edge_case",
  "artifact_paths": [
    "sandbox/runs/SR-a63546096e/stdout.log",
    "sandbox/runs/SR-a63546096e/stderr.log"
  ],
  "classification": "duplicate_replay",
  "created_at": "2026-05-05T01:50:07.259712Z",
  "exit_code": 0,
  "expected_result": "Existing result reused or duplicate rejected.",
  "failure_case_id": "FC-0001",
  "promotion_status": "pending_operator_review",
  "receipt_hash": "cfbf86613c75611b311ea99f64ce58243e75b512b030c3921e1a0ce0b21fbe4f",
  "receipt_id": "FHR-e458eed4e2",
  "repro_command": "./scripts/replay_failure.sh sandbox/receipts/FHR-e458eed4e2.json",
  "reproducible": true,
  "sandbox_run_id": "SR-a63546096e",
  "schema_version": "FailureHarvestReceipt.v1",
  "severity": "high",
  "stderr_excerpt": "",
  "stdout_excerpt": "",
  "target_ref": "demo",
  "target_repo": "example-repo"
}