{
  "actual_result": "duplicate input created a new record: first_id='r0001' second_id='r0002' size=2",
  "agent_lane": "edge_case",
  "artifact_paths": [
    "sandbox/runs/SR-no-canonical-mutation/stdout.log",
    "sandbox/runs/SR-no-canonical-mutation/stderr.log"
  ],
  "classification": "duplicate_replay",
  "created_at": "2026-05-21T20:58:26.719243Z",
  "exit_code": 0,
  "expected_result": "Existing result reused or duplicate rejected.",
  "failure_case_id": "FC-0001",
  "promotion_status": "pending_operator_review",
  "receipt_hash": "21fdfbf37fafc35b9968448322cae0b6309823b6d99a9f4ac40009e243c5ea9d",
  "receipt_id": "FHR-4feb6e9f64",
  "repro_command": "./scripts/replay_failure.sh sandbox/receipts/FHR-4feb6e9f64.json",
  "reproducible": true,
  "sandbox_run_id": "SR-no-canonical-mutation",
  "schema_version": "FailureHarvestReceipt.v1",
  "severity": "high",
  "stderr_excerpt": "",
  "stdout_excerpt": "",
  "target_ref": "no-canonical-mutation",
  "target_repo": "example-repo"
}