{
  "actual_result": "registry rejected as expected: TypeError('payload must be a mapping')",
  "agent_lane": "edge_case",
  "artifact_paths": [
    "sandbox/runs/SR-37d9b23160/stdout.log",
    "sandbox/runs/SR-37d9b23160/stderr.log"
  ],
  "classification": "no_failure_observed",
  "created_at": "2026-05-20T17:25:54.152665Z",
  "exit_code": 0,
  "expected_result": "Validation error, registry remains stable.",
  "failure_case_id": "FC-0006",
  "promotion_status": "pending_operator_review",
  "receipt_hash": "3960a02373b6bea6a0d3d03d5f08eb22a8dba94d945dc9532521de0665cfd977",
  "receipt_id": "FHR-8220bb7304",
  "repro_command": "./scripts/replay_failure.sh sandbox/receipts/FHR-8220bb7304.json",
  "reproducible": true,
  "sandbox_run_id": "SR-37d9b23160",
  "schema_version": "FailureHarvestReceipt.v1",
  "severity": "info",
  "stderr_excerpt": "",
  "stdout_excerpt": "",
  "target_ref": "ci-gate",
  "target_repo": "example-repo"
}